Title,Date Published,Reviews,Author(s),Genre,Type,Format
The Inevitable: Understanding the 12 Technological Forces That Will Shape Our Future, 2017,1111,Kevin Kelly,Education & History,Fiction,Paperback
"Make Mead Like a Viking: Traditional Techniques for Brewing Natural, Wild-Fermented, Honey-Based Wines and Beers", 2015,1109,Jereme Zimmerman,Education & History,Non Fiction,Audio CD
"The Prepper's Water Survival Guide: Harvest, Treat, and Store Your Most Vital Resource", 2015,1112,Daisy Luther,Education & History,Fiction,Hardcover
"Granite Mountain: The Firsthand Account of a Tragic Wildfire, Its Lone Survivor, and the Firefighters Who Made the Ultimate Sacrifice", 2017,1110,Brendan McDonough,Education & History,Non Fiction,Paperback
Come and Get Us (BookShots), 2016,1183,James Patterson,Education & History,Fiction,Audio CD
The Red Circle: My Life in the Navy SEAL Sniper Corps and How I Trained America's Deadliest Marksmen, 2012,1174,Brandon Webb,Education & History,Non Fiction,Hardcover
"Learn to Timber Frame: Craftsmanship, Simplicity, Timeless Beauty", 2016,1167,Will Beemer,Education & History,Fiction,Paperback
Carrying the Fire, 2019,1172,Michael Collins,Education & History,Non Fiction,Audio CD
How to Read Water: Clues and Patterns from Puddles to the Sea (Natural Navigation), 2016,1157,Tristan Gooley,Education & History,Fiction,Hardcover
Zero Waste Home: The Ultimate Guide to Simplifying Your Life by Reducing Your Waste, 2013,1163,Bea Johnson,Education & History,Non Fiction,Paperback
Apollo 13: Anniversary Edition, 2000,1157,Jeffrey Kluger,Education & History,Fiction,Audio CD
"The Lost Boys of Montauk: The True Story of the Wind Blown, Four Men Who Vanished at Sea, and the Survivors They Left Behind", 2022,1161,Amanda M. Fairbanks,Education & History,Non Fiction,Hardcover
What It Is Like To Go To War, 2012,1156,Karl Marlantes,Education & History,Fiction,Paperback
The Box-car Children, 2021,1158,Gertrude Chandler Warner,Education & History,Non Fiction,Audio CD
"Bold: How to Go Big, Create Wealth and Impact the World (Exponential Technology Series)", 2016,1159,Peter H. Diamandis,Education & History,Fiction,Hardcover
Genome: The Autobiography of a Species in 23 Chapters, 2006,1142,Matt Ridley,Education & History,Non Fiction,Paperback
Down Among the Dead Men, 2011,1141,Michelle Williams,Education & History,Fiction,Audio CD
Carrying the Fire: An Astronaut's Journeys, 2009,1222,Michael Collins,Education & History,Non Fiction,Hardcover
Classic Car: The Definitive Visual History, 2016,1220,DK,Education & History,Fiction,Paperback
Numbers Don't Lie: 71 Things You Need to Know About the World, 2021,1218,Vaclav Smil,Education & History,Non Fiction,Audio CD
Dreamland: An Autobiography, 2019,1208,Bob Lazar,Education & History,Fiction,Hardcover
"Fresh Eggs Daily: Raising Happy, Healthy Chickens...Naturally", 2013,1206,Lisa Steele,Education & History,Non Fiction,Paperback
The Game Console: A History in Photographs, 2018,1200,Evan Amos,Education & History,Fiction,Audio CD
"The Second Machine Age: Work, Progress, and Prosperity in a Time of Brilliant Technologies", 2016,1194,Erik Brynjolfsson,Education & History,Non Fiction,Hardcover
"Navigation Rules and Regulations Handbook: CURRENT EDITION, Meets USCG Carriage Requirements. UPDATED TO INCLUDE NTM 18-20", 2014,1202,United States Coast Guard,Education & History,Fiction,Paperback
"The Arsenal of Democracy: FDR, Detroit, and an Epic Quest to Arm an America at War", 2015,1190,A. J. Baime,Education & History,Non Fiction,Audio CD
The Ashley Book of Knots, 1944,1184,Clifford W. Ashley,Education & History,Fiction,Hardcover
Root Cellaring: Natural Cold Storage of Fruits & Vegetables, 1991,1184,Mike Bubel,Education & History,Non Fiction,Paperback
"Hyperspace: A Scientific Odyssey through Parallel Universes, Time Warps, and the Tenth Dimension", 1994,1179,Michio Kaku,Education & History,Fiction,Audio CD
The Moth Presents All These Wonders: True Stories About Facing the Unknown, 2017,1182,Catherine Burns,Education & History,Non Fiction,Hardcover
Aquaponic Gardening: A Step-by-Step Guide to Raising Vegetables and Fish Together, 2011,1182,Sylvia Bernstein,Education & History,Fiction,Paperback
The Winter Fortress: The Epic Mission to Sabotage Hitler's Atomic Bomb, 2017,1178,Neal Bascomb,Education & History,Non Fiction,Audio CD
Super Pumped: The Battle for Uber, 2020,1257,Mike Isaac,Education & History,Fiction,Hardcover
The Eye Book (Bright & Early Board Books(TM)), 2001,1250,Joe Mathieu,Education & History,Non Fiction,Paperback
Rocket Men: The Daring Odyssey of Apollo 8 and the Astronauts Who Made Man's First Journey to the Moon, 2018,1252,Robert Kurson,Education & History,Fiction,Audio CD
The Old Farmer's Almanac 2019/Comfort Food Cookbook/Sun Catcher Bundle, 2018,1252,Old Farmer’s Almanac,Education & History,Non Fiction,Hardcover
"Console Wars: Sega, Nintendo, and the Battle that Defined a Generation", 2015,1249,Blake J. Harris,Education & History,Fiction,Paperback
"The Phantom Atlas: The Greatest Myths, Lies and Blunders on Maps (Historical Map and Mythology Book, Geography Book of Ancient and Antique Maps)", 2018,1242,Edward Brooke-Hitching,Education & History,Non Fiction,Audio CD
"Solar Energy: The Physics and Engineering of Photovoltaic Conversion, Technologies and Systems", 2016,1243,Arno Smets,Education & History,Fiction,Hardcover
Solar & 12 Volt Power for beginners: off grid power for everyone, 2017,1223,George Eccleston,Education & History,Non Fiction,Paperback
Bond Cars: The Definitive History, 2021,1226,Jason Barlow,Education & History,Fiction,Audio CD
Grease Junkie, 2020,1300,Edd China,Education & History,Non Fiction,Hardcover
Sink Em All: Submarine Warfare in the Pacific, 2021,1296,Charles A. Lockwood,Education & History,Fiction,Paperback
Low Level Hell, 1993,1294,Hugh L. Mills Jr.,Education & History,Non Fiction,Audio CD
Ultimate Book of Home Plans: 780 Home Plans in Full Color: North America's Premier Designer Network: Special Sections on Home Design & Outdoor Living Ideas (Creative Homeowner) Over 550 Color Photos, 2015,1297,Editors of Creative Homeowner,Education & History,Fiction,Hardcover
Mixing Secrets for the Small Studio (Sound On Sound Presents...), 2018,1291,Mike Senior,Education & History,Non Fiction,Paperback
"100 Cars That Changed the World: The Designs, Engines, and Technologies That Drive Our Imaginations", 2020,1287,Publications International Ltd.,Education & History,Fiction,Audio CD
Super Rabbit Racers!: A Branches Book (Press Start! #3) (3), 2017,1282,Thomas Flintham,Education & History,Non Fiction,Hardcover
Ferry Pilot: Nine Lives Over the North Atlantic, 2020,1288,Kerry McCauley,Education & History,Fiction,Paperback
"Proficient Motorcycling: The Ultimate Guide to Riding Well, Updated & Expanded 2nd Edition (CompanionHouse Books) The Must-Have Manual: Confront Fears, Sharpen Handling Skills, & Learn to Ride Safely", 2013,1267,David L. Hough,Education & History,Non Fiction,Audio CD
Un verdor terrible (Spanish Edition), 2020,1268,Benjamín Labatut,Education & History,Fiction,Hardcover
Cradle to Cradle: Remaking the Way We Make Things, 2002,1263,William McDonough,Education & History,Non Fiction,Paperback
Stick and Rudder: An Explanation of the Art of Flying, 1990,1338,Wolfgang Langewiesche,Education & History,Fiction,Audio CD
The Perfectionists: How Precision Engineers Created the Modern World, 2019,1332,Simon Winchester,Education & History,Non Fiction,Hardcover
Auto Log Book, 2015,1325,Peter Pauper Press,Education & History,Fiction,Paperback
The Singularity Is Near: When Humans Transcend Biology, 2006,1332,Ray Kurzweil,Education & History,Non Fiction,Audio CD
101 Things I Learned in Architecture School, 2007,1321,Matthew Frederick,Education & History,Fiction,Hardcover
Welding For Dummies, 2010,1324,Steven Robert Farnsworth,Education & History,Non Fiction,Paperback
A Rumor of War Philip Caputo 1977, 1977,1322,Philip Caputo,Education & History,Fiction,Audio CD
Make: Electronics: Learning Through Discovery, 2015,1314,Charles Platt,Education & History,Non Fiction,Hardcover
Physics of the Future: How Science Will Shape Human Destiny and Our Daily Lives by the Year 2100, 2012,1309,Michio Kaku,Education & History,Fiction,Paperback
Life on the Mississippi (Signet Classics), 2009,1310,Mark Twain,Education & History,Non Fiction,Audio CD
Dirt to Soil: One Family’s Journey into Regenerative Agriculture, 2018,1310,Gabe Brown,Education & History,Fiction,Hardcover
Chaos Monkeys: Obscene Fortune and Random Failure in Silicon Valley, 2018,1315,Antonio Garcia Martinez,Education & History,Non Fiction,Paperback
"Storey's Guide to Raising Chickens, 4th Edition: Breed Selection, Facilities, Feeding, Health Care, Managing Layers & Meat Birds", 2017,1315,Gail Damerow,Education & History,Fiction,Audio CD
"The Mission, The Men, and Me: Lessons from a Former Delta Force Commander", 2008,1304,Pete Blaber,Education & History,Non Fiction,Hardcover
Nothing Like it in the World: The Men that Built the Transcontinental Railroad, 2001,1297,Stephen E. Ambrose,Education & History,Fiction,Paperback
Stuff Matters: Exploring the Marvelous Materials That Shape Our Man-Made World, 2015,1401,Mark Miodownik,Education & History,Non Fiction,Audio CD
The Kill Chain: Defending America in the Future of High-Tech Warfare, 2022,1387,Christian Brose,Education & History,Fiction,Hardcover
American Gun: A History of the U.S. in Ten Firearms (P.S.), 2014,1382,Chris Kyle,Education & History,Non Fiction,Paperback
Irresistible: The Rise of Addictive Technology and the Business of Keeping Us Hooked, 2018,1374,Adam Alter,Education & History,Fiction,Audio CD
The Longest Winter: The Battle of the Bulge and the Epic Story of World War II's Most Decorated Platoon, 2004,1374,Alex Kershaw,Education & History,Non Fiction,Hardcover
The Self-Sufficient Life and How to Live It: The Complete Back-to-Basics Guide, 2018,1369,John Seymour,Education & History,Fiction,Paperback
DEWALT Carpentry and Framing Complete Handbook (DEWALT Series), 2018,1366,Gary Brackett,Education & History,Non Fiction,Audio CD
The Code Book: The Science of Secrecy from Ancient Egypt to Quantum Cryptography, 2000,1355,Simon Singh,Education & History,Fiction,Hardcover
How Innovation Works: And Why It Flourishes in Freedom, 2021,1350,Matt Ridley,Education & History,Non Fiction,Paperback
"The Metal Detecting Bible: Helpful Tips, Expert Tricks and Insider Secrets for Finding Hidden Treasures", 2016,1356,Brandon Neice,Education & History,Fiction,Audio CD
Last Train to Paradise: Henry Flagler and the Spectacular Rise and Fall of the Railroad that Crossed an Ocean, 2003,1355,Les Standiford,Education & History,Non Fiction,Hardcover
A Sand County Almanac (Outdoor Essays & Reflections), 1986,1341,Aldo Leopold,Education & History,Fiction,Paperback
Farm Anatomy: The Curious Parts and Pieces of Country Life, 2011,1341,Julia Rothman,Education & History,Non Fiction,Audio CD
"The Big Book of Small Home Plans: Over 360 Home Plans Under 1200 Square Feet (Creative Homeowner) Cabins, Cottages, & Tiny Houses, Plus How to Maximize Your Living Space with Organization & Decorating", 2017,1343,Design America Inc.,Education & History,Fiction,Hardcover
Woodworking: The Complete Step-by-Step Manual, 2020,1449,DK,Education & History,Non Fiction,Paperback
The CIA Lockpicking Manual, 2011,1450,Central Intelligence Agency,Education & History,Fiction,Audio CD
Hell's Angel: The Life and Times of Sonny Barger and the Hell's Angels Motorcycle Club, 2001,1436,Sonny Barger,Education & History,Non Fiction,Hardcover
A Crack In Creation: Gene Editing and the Unthinkable Power to Control Evolution, 2018,1439,Jennifer A. Doudna,Education & History,Fiction,Paperback
Come Fly The World: The Jet-Age Story of the Women of Pan Am, 2022,1439,Julia Cooke,Education & History,Non Fiction,Audio CD
A World Without Email: Find Focus and Transform the Way You Work Forever (from the NYT bestselling productivity expert), 2021,1432,Cal Newport,Education & History,Fiction,Hardcover
Dark Slayer (Carpathian), 2009,1421,Christine Feehan,Education & History,Non Fiction,Paperback
"The Backyard Beekeeper, 4th Edition: An Absolute Beginner's Guide to Keeping Bees in Your Yard and Garden", 2018,1406,Kim Flottum,Education & History,Fiction,Audio CD
How to Rebuild GM LS-Series Engines (S-A Design), 2008,1413,Chris Werner,Education & History,Non Fiction,Hardcover
"The Prize: The Epic Quest for Oil, Money & Power", 2008,1409,Daniel Yergin,Education & History,Fiction,Paperback
Red Famine: Stalin's War on Ukraine, 2017,1402,Anne Applebaum,Education & History,Non Fiction,Audio CD
Basic butchering of livestock & game, 1986,1396,John J Mettler,Education & History,Fiction,Hardcover
The Poisoner's Handbook: Murder and the Birth of Forensic Medicine in Jazz Age New York, 2010,1400,Deborah Blum,Education & History,Non Fiction,Paperback
"Soap Making Business Startup: How to Start, Run & Grow a Million Dollar Success From Home!", 2016,1540,Suzanne Carpenter,Education & History,Fiction,Audio CD
"Butchering Poultry, Rabbit, Lamb, Goat, and Pork: The Comprehensive Photographic Guide to Humane Slaughtering and Butchering", 2014,1544,Adam Danforth,Education & History,Non Fiction,Hardcover
Work Rules!: Insights from Inside Google That Will Transform How You Live and Lead, 2015,1524,Laszlo Bock,Education & History,Fiction,Paperback
Harrier 809: Britain’s Legendary Jump Jet and the Untold Story of the Falklands War, 2020,1522,Rowland White,Education & History,Non Fiction,Audio CD
"Summer Learning HeadStart, Grade 7 to 8: Fun Activities Plus Math, Reading, and Language Workbooks: Bridge to Success with Common Core Aligned ... (Summer Learning HeadStart by Lumos Learning)", 2015,1516,Lumos Learning,Education & History,Fiction,Hardcover
Flash and Bones: A Novel (14) (A Temperance Brennan Novel), 2012,1510,Kathy Reichs,Education & History,Non Fiction,Paperback
The Design of Everyday Things, 2002,1495,Donald A. Norman,Education & History,Fiction,Audio CD
How Cars Work, 1999,1486,Tom Newton,Education & History,Non Fiction,Hardcover
Built for Speed: The World's Fastest Road Cars, 2019,1478,Publications International Ltd.,Education & History,Fiction,Paperback
Steve Jobs / Steve Jobs: A Biography (Spanish Edition), 2019,1485,Walter Isaacson,Education & History,Non Fiction,Audio CD
The Joint Book: The Complete Guide to Wood Joinery, 2009,1484,Terrie Noll,Education & History,Fiction,Hardcover
Simple & Natural Soapmaking: Create 100% Pure and Beautiful Soaps with The Nerdy Farm Wife’s Easy Recipes and Techniques, 2017,1479,Jan Berry,Education & History,Non Fiction,Paperback
Always Young and Restless: My Life On and Off America's #1 Daytime Drama, 2020,1451,Melody Thomas Scott,Education & History,Fiction,Audio CD
"Beginner's Guide to Reading Schematics, Fourth Edition", 2018,1443,Stan Gibilisco,Education & History,Non Fiction,Hardcover
Cosmic Serpent: DNA and the Origins of Knowledge, 1999,1625,Jeremy Narby,Education & History,Fiction,Paperback
Who We Are and How We Got Here: Ancient DNA and the New Science of the Human Past, 2019,1621,David Reich,Education & History,Non Fiction,Audio CD
The Art of War: The Ancient Classic, 2010,1623,Tom Butler-Bowdon,Education & History,Fiction,Hardcover
The Big Burn: Teddy Roosevelt and the Fire that Saved America, 2010,1602,Timothy Egan,Education & History,Non Fiction,Paperback
Dieta Cetogénica: El protocolo de una alimentación efectiva (Spanish Edition), 2019,1593,Carlos Stro,Education & History,Fiction,Audio CD
Reading Comprehension Grade 1 for Improvement of Reading & Conveniently Used: 1st Grade Reading Comprehension Workbooks for 1st Graders to Combine Fun & Education Together, 2018,1603,Patrick N. Peerson,Education & History,Non Fiction,Hardcover
Industrial Society and Its Future, 2018,1581,Theodore John Kaczynski,Education & History,Fiction,Paperback
Horse Soldiers: The Extraordinary Story of a Band of US Soldiers Who Rode to Victory in Afghanistan, 2010,1584,Doug Stanton,Education & History,Non Fiction,Audio CD
"Programming Arduino: Getting Started with Sketches, Second Edition (Tab)", 2016,1579,Simon Monk,Education & History,Fiction,Hardcover
"Wilderness Navigation: Finding Your Way Using Map, Compass, Altimeter & GPS, 3rd Edition (Mountaineers Outdoor Basics)", 2015,1572,Bob Burns,Education & History,Non Fiction,Paperback
"The Future of the Mind: The Scientific Quest to Understand, Enhance, and Empower the Mind", 2014,1565,Michio Kaku,Education & History,Fiction,Audio CD
ASVAB Prep Plus 2018-2019: 6 Practice Tests + Proven Strategies + Online + Video (Kaplan Test Prep), 2017,1565,Kaplan Test Prep,Education & History,Non Fiction,Hardcover
Structures: Or Why Things Don't Fall Down, 2003,1559,J. E. Gordon,Education & History,Fiction,Paperback
Failure Is Not an Option: Mission Control From Mercury to Apollo 13 and Beyond, 2009,1547,Gene Kranz,Education & History,Non Fiction,Audio CD
Voices From Chernobyl: The Oral History of a Nuclear Disaster, 2005,1697,Svetlana Alexievich,Education & History,Fiction,Hardcover
The Manager's Path: A Guide for Tech Leaders Navigating Growth and Change, 2017,1694,Camille Fournier,Education & History,Non Fiction,Paperback
Pale Blue Dot: A Vision of the Human Future in Space, 1997,1688,Carl Sagan,Education & History,Fiction,Audio CD
"Hello, Is This Planet Earth?: My View from the International Space Station", 2017,1688,Tim Peake,Education & History,Non Fiction,Hardcover
The Future of Humanity: Our Destiny in the Universe, 2019,1674,Michio Kaku,Education & History,Fiction,Paperback
The Practice: Shipping creative work, 2020,1671,Seth Godin,Education & History,Non Fiction,Audio CD
"Stealing Fire: How Silicon Valley, the Navy SEALs, and Maverick Scientists Are Revolutionizing the Way We Live and Work", 2018,1673,Steven Kotler,Education & History,Fiction,Hardcover
Abundance: The Future Is Better Than You Think (Exponential Technology Series), 2014,1670,Peter H. Diamandis,Education & History,Non Fiction,Paperback
Beekeeping For Dummies, 2020,1659,Howland Blackiston,Education & History,Fiction,Audio CD
"Pure, White, and Deadly: How Sugar Is Killing Us and What We Can Do to Stop It", 2013,1654,John Yudkin,Education & History,Non Fiction,Hardcover
"Take the Slow Road: Scotland: Inspirational Journeys Round the Highlands, Lowlands and Islands of Scotland by Camper Van and Motorhome", 2018,1637,Martin Dorey,Education & History,Fiction,Paperback
"Lights Out: A Cyberattack, A Nation Unprepared, Surviving the Aftermath", 2016,1634,Ted Koppel,Education & History,Non Fiction,Audio CD
The Art of Electronics, 2015,1779,Paul Horowitz,Education & History,Fiction,Hardcover
Area 51: An Uncensored History of America's Top Secret Military Base, 2012,1769,Annie Jacobsen,Education & History,Non Fiction,Paperback
Thunder Below!: The USS *Barb* Revolutionizes Submarine Warfare in World War II, 1997,1765,Eugene B. Fluckey,Education & History,Fiction,Audio CD
"Practical Electronics for Inventors, Fourth Edition", 2016,1770,Paul Scherz,Education & History,Non Fiction,Hardcover
"The New Map: Energy, Climate, and the Clash of Nations", 2021,1777,Daniel Yergin,Education & History,Fiction,Paperback
The Ultimate Cigar Book: 4th Edition, 2015,1748,Richard Carleton Hacker,Education & History,Non Fiction,Audio CD
The Case for Keto: Rethinking Weight Control and the Science and Practice of Low-Carb/High-Fat Eating, 2021,1750,Gary Taubes,Education & History,Fiction,Hardcover
"An Officer, Not a Gentleman: The inspirational journey of a pioneering female fighter pilot", 2020,1746,Mandy Hickson,Education & History,Non Fiction,Paperback
The Book of Five Rings: A Classic Text on the Japanese Way of the Sword (Shambhala Library), 2005,1734,Miyamoto Musashi,Education & History,Fiction,Audio CD
"On Combat, The Psychology and Physiology of Deadly Conflict in War and in Peace", 2008,1725,Dave Grossman,Education & History,Non Fiction,Hardcover
The official DVSA guide to driving: the essential skills, 2019,1716,Driver and Vehicle Standards Agency,Education & History,Fiction,Paperback
The Rational Optimist: How Prosperity Evolves (P.S.), 2011,1704,Matt Ridley,Education & History,Non Fiction,Audio CD
The Backyard Blacksmith: Traditional Techniques for the Modern Smith (Backyard Series), 2006,1868,Lorelei Sims,Education & History,Fiction,Hardcover
"UNREPORTED TRUTHS ABOUT COVID-19 AND LOCKDOWNS: Combined Parts 1-3: Death Counts, Lockdowns, and Masks", 2020,1844,Alex Berenson,Education & History,Non Fiction,Paperback
Auto Repair For Dummies, 2019,1845,Deanna Sclar,Education & History,Fiction,Audio CD
Lone Rider: The First British Woman to Motorcycle Around the World, 2018,1846,Elspeth Beard,Education & History,Non Fiction,Hardcover
"Lights Out: Pride, Delusion, and the Fall of General Electric", 2021,1836,Thomas Gryta,Education & History,Fiction,Paperback
The Book of Incredible Information, 2015,1800,Publications International Ltd.,Education & History,Non Fiction,Audio CD
Bradshaw’s Handbook (Old House), 2012,1797,George Bradshaw,Education & History,Fiction,Hardcover
The Smartest Guys in the Room: The Amazing Rise and Scandalous Fall of Enron, 2013,1800,Bethany McLean,Education & History,Non Fiction,Paperback
Alive, 2005,1808,Piers Paul Read,Education & History,Fiction,Audio CD
Star Wars Complete Vehicles New Edition, 2020,1791,Pablo Hidalgo,Education & History,Non Fiction,Hardcover
The Very Efficient Carpenter: Basic Framing for Residential Construction (For Pros / By Pros), 1998,1797,Larry Haun,Education & History,Fiction,Paperback
"Off Grid Solar Power Simplified: For Rvs, Vans, Cabins, Boats and Tiny Homes", 2020,1786,Nick Seghers,Education & History,Non Fiction,Audio CD
"Black & Decker The Complete Guide to Wiring, Updated 7th Edition: Current with 2017-2020 Electrical Codes (Volume 7) (Black & Decker Complete Guide, 7)", 2017,1948,Editors of Cool Springs Press,Education & History,Fiction,Hardcover
"Norwegian Wood: Chopping, Stacking, and Drying Wood the Scandinavian Way", 2015,1948,Lars Mytting,Education & History,Non Fiction,Paperback
"Can You Make This Thing Go Faster? (The World According to Clarkson, 8)", 2021,1936,Jeremy Clarkson,Education & History,Fiction,Audio CD
"Illustrated Cabinetmaking: How to Design and Construct Furniture That Works (Fox Chapel Publishing) Over 1300 Drawings & Diagrams for Drawers, Tables, Beds, Bookcases, Cabinets, Joints & Subassemblies", 2008,1932,Bill Hylton,Education & History,Non Fiction,Hardcover
"The Path Between the Seas: The Creation of the Panama Canal, 1870-1914", 2003,1931,David McCullough,Education & History,Fiction,Paperback
University of Berkshire Hathaway: 30 Years of Lessons Learned from Warren Buffett & Charlie Munger at the Annual Shareholders Meeting, 2017,1919,Daniel Pecaut,Education & History,Non Fiction,Audio CD
Tank: The Definitive Visual History of Armored Vehicles, 2017,1902,DK,Education & History,Fiction,Hardcover
The Beginner's Guide to Essential Oils: Everything You Need to Know to Get Started, 2019,1891,Christina Anthis,Education & History,Non Fiction,Paperback
The Cannabis Encyclopedia: The Definitive Guide to Cultivation & Consumption of Medical Marijuana, 2015,1891,Jorge Cervantes,Education & History,Fiction,Audio CD
"The Book on Estimating Rehab Costs: The Investor's Guide to Defining Your Renovation Plan, Building Your Budget, and Knowing Exactly How Much It All Costs (Fix-and-Flip, 2)", 2019,1882,J Scott,Education & History,Non Fiction,Hardcover
DIY Lithium Batteries: How to Build Your Own Battery Packs, 2017,1888,Micah Toll,Education & History,Fiction,Paperback
The Market Gardener: A Successful Grower's Handbook for Small-Scale Organic Farming, 2014,1881,Jean-Martin Fortier,Education & History,Non Fiction,Audio CD
The Invisible Rainbow: A History of Electricity and Life, 2020,2046,Arthur Firstenberg,Education & History,Fiction,Hardcover
Alan Turing: The Enigma: The Book That Inspired the Film The Imitation Game - Updated Edition, 2014,2037,Andrew Hodges,Education & History,Non Fiction,Paperback
When They Find Us (Agent Victoria Heslin Series), 2020,2035,Jenifer Ruff,Education & History,Fiction,Audio CD
"The Honey Bus: A Memoir of Loss, Courage and a Girl Saved by Bees", 2020,2001,Meredith May,Education & History,Non Fiction,Hardcover
Value Proposition Design: How to Create Products and Services Customers Want (The Strategyzer Series), 2014,2001,Alexander Osterwalder,Education & History,Fiction,Paperback
October Sky (The Coalwood Series #1), 1999,1984,Homer Hickam,Education & History,Non Fiction,Audio CD
The Art of War, 1910,1972,Sun Tzu,Education & History,Fiction,Hardcover
Good Clean Fun: Misadventures in Sawdust at Offerman Woodshop, 2016,1974,Nick Offerman,Education & History,Non Fiction,Paperback
Beekeeping For Dummies (For Dummies (Pets)), 2017,1981,Howland Blackiston,Education & History,Fiction,Audio CD
"The Sky Below: A True Story of Summits, Space, and Speed", 2017,1968,Scott Parazynski,Education & History,Non Fiction,Hardcover
No One Is Too Small to Make a Difference, 2019,1966,Greta Thunberg,Education & History,Fiction,Paperback
"Devotion: An Epic Story of Heroism, Friendship, and Sacrifice", 2017,1961,Adam Makos,Education & History,Non Fiction,Audio CD
Introduction to Electrodynamics, 2017,1948,David J. Griffiths,Education & History,Fiction,Hardcover
The Shallows: What the Internet Is Doing to Our Brains, 2020,2151,Nicholas Carr,Education & History,Non Fiction,Paperback
"Go Like Hell: Ford, Ferrari, and Their Battle for Speed and Glory at Le Mans", 2010,2151,A. J. Baime,Education & History,Fiction,Audio CD
