Title,Date Published,Reviews,Author(s),Genre,Type,Format
"The Paris Connection: Escape to Paris with the funny, romantic and feel-good love story of 2022!", 2022,820,Lorraine Brown,Education & History,Non Fiction,Paperback
Somebody Swallowed Stanley, 2019,821,Sarah Roberts,Education & History,Fiction,Audio CD
Collins Complete Woodworker's Manual, 2005,818,Albert Jackson,Education & History,Non Fiction,Hardcover
Building Beehives For Dummies, 2019,816,Howland Blackiston,Education & History,Fiction,Paperback
If You’d Just Let Me Finish, 2019,814,Jeremy Clarkson,Education & History,Non Fiction,Audio CD
The Complete Book of Corvette: Every Model Since 1953 - Revised & Updated Includes New Mid-Engine Corvette Stingray (Complete Book Series), 2020,810,Mike Mueller,Education & History,Fiction,Hardcover
Special Operations Forces Medical Handbook, 2011,815,Department of Defense,Education & History,Non Fiction,Paperback
Compact Cabins: Simple Living in 1000 Square Feet or Less, 2010,807,Gerald Rowan,Education & History,Fiction,Audio CD
Going Off the Grid: The How-To-Book of Simple Living and Happiness, 2017,811,Gary Collins,Education & History,Non Fiction,Hardcover
"The Backyard Homestead Book of Building Projects: 76 Useful Things You Can Build to Create Customized Working Spaces and Storage Facilities, Equip the ... Animals, and Make Practical Outdoor Furniture", 2014,807,Spike Carlsen,Education & History,Fiction,Paperback
Aircraft: The Definitive Visual History (DK Smithsonian), 2022,812,DK,Education & History,Non Fiction,Audio CD
Fly Into the Wind: How to Harness Faith and Fearlessness on Your Ascent to Greatness, 2020,807,Lt Colonel Dan Rooney,Education & History,Fiction,Hardcover
The Outlaw Ocean: Journeys Across the Last Untamed Frontier, 2020,806,Ian Urbina,Education & History,Non Fiction,Paperback
Competing in the Age of AI: Strategy and Leadership When Algorithms and Networks Run the World, 2020,803,Marco Iansiti,Education & History,Fiction,Audio CD
101 Projects for Your Porsche Boxster (Motorbooks Workshop), 2011,841,Wayne R. Dempsey,Education & History,Non Fiction,Hardcover
"Big Data: A Revolution That Will Transform How We Live, Work, and Think", 2014,841,Viktor Mayer-Schönberger,Education & History,Fiction,Paperback
Quantum Physics for Beginners: From Wave Theory to Quantum Computing. Understanding How Everything Works by a Simplified Explanation of Quantum Physics and Mechanics Principles, 2021,841,Carl J. Pratt,Education & History,Non Fiction,Audio CD
The Great Railway Bazaar, 2006,844,Paul Theroux,Education & History,Fiction,Hardcover
Word Search for Kids Ages 8-10: 100 Word Search Puzzles, 2021,841,Word Adventure Books,Education & History,Non Fiction,Paperback
"Crafting with Wood Pallets: Projects for Rustic Furniture, Decor, Art, Gifts and more", 2015,834,Becky Lamb,Education & History,Fiction,Audio CD
The World Is Flat 3.0: A Brief History of the Twenty-first Century (Further Updated and Expanded), 2007,838,Thomas L. Friedman,Education & History,Non Fiction,Hardcover
Address Book, 2021,829,Deirdre Mask,Education & History,Fiction,Paperback
Mathematische Formelsammlung: Für Ingenieure und Naturwissenschaftler (German Edition), 2017,837,Lothar Papula,Education & History,Non Fiction,Audio CD
"The Information: A History, A Theory, A Flood", 2012,834,James Gleick,Education & History,Fiction,Hardcover
Kill Anything That Moves: The Real American War in Vietnam (American Empire Project), 2013,833,Nick Turse,Education & History,Non Fiction,Paperback
"Storey's Guide to Raising Ducks, 2nd Edition: Breeds, Care, Health", 2011,828,Dave Holderread,Education & History,Fiction,Audio CD
"The Iceman Inheritance: Prehistoric Sources of Western Man's Racism, Sexism and Aggression", 1991,827,John Henrik Clarke,Education & History,Non Fiction,Hardcover
"1-2-3 Count with Car Parts (123 Baby Book, Children's Book, Toddler Book, Kids Book)", 2020,825,Fast Kids Club,Education & History,Fiction,Paperback
VW Beetle & Karmann Ghia 1954 through 1979 All Models (Haynes Repair Manual), 1998,822,Ken Freund,Education & History,Non Fiction,Audio CD
Lost in Math: How Beauty Leads Physics Astray, 2020,853,Sabine Hossenfelder,Education & History,Fiction,Hardcover
Designing Great Beers: The Ultimate Guide to Brewing Classic Beer Styles, 1998,857,Ray Daniels,Education & History,Non Fiction,Paperback
"Wild Fermentation: The Flavor, Nutrition, and Craft of Live-Culture Foods, 2nd Edition", 2016,850,Sandor Ellix Katz,Education & History,Fiction,Audio CD
"Building a Strip Canoe, Second Edition, Revised & Expanded: Full-Sized Plans and Instructions for 8 Easy-To-Build, Field-Tested Canoes (Fox Chapel Publishing) Step-by-Step; 100+ Photos & Illustrations", 2010,856,Gil Gilpatrick,Education & History,Non Fiction,Hardcover
The Complete Book of Clean: Tips & Techniques for Your Home, 2019,846,Toni Hammersley,Education & History,Fiction,Paperback
Stuka Pilot, 2012,848,Hans Ulrich Rudel,Education & History,Non Fiction,Audio CD
Technical Communication, 2017,851,Mike Markel,Education & History,Fiction,Hardcover
How to Build and Modify GM LS-Series Engines (Motorbooks Workshop), 2009,848,Joseph Potak,Education & History,Non Fiction,Paperback
A Medium-sized Book of Boring Car Trivia, 2020,851,Sniff Petrol,Education & History,Fiction,Audio CD
Wiring a House: 5th Edition (For Pros By Pros), 2014,847,Rex Cauldwell,Education & History,Non Fiction,Hardcover
DIY Solar Power: How To Power Everything From The Sun, 2017,848,Micah Toll,Education & History,Fiction,Paperback
Delta Force, 1983,849,Charlie A. Beckwith,Education & History,Non Fiction,Audio CD
Far and Wide: Bring That Horizon to Me!, 2018,845,Neil Peart,Education & History,Fiction,Hardcover
The Courage to Face COVID-19: Preventing Hospitalization and Death While Battling the Bio-Pharmaceutical Complex, 2022,872,John Leake,Education & History,Non Fiction,Paperback
Dig Dig Digging (Orchard Red Apple), 2002,870,Margaret Mayo,Education & History,Fiction,Audio CD
Skyfaring: A Journey with a Pilot (Vintage Departures), 2016,868,Mark Vanhoenacker,Education & History,Non Fiction,Hardcover
Viral: The Search for the Origin of COVID-19, 2021,871,Matt Ridley,Education & History,Fiction,Paperback
"The Productivity Project: Accomplishing More by Managing Your Time, Attention, and Energy", 2017,863,Chris Bailey,Education & History,Non Fiction,Audio CD
Building Construction Illustrated, 2020,861,Francis D. K. Ching,Education & History,Fiction,Hardcover
"Going the Wrong Way: A young Belfast man sets off on his Moto Guzzi Le Mans, to find himself, and the road to Australia. What could possibly go wrong!", 2021,868,Chris Donaldson,Education & History,Non Fiction,Paperback
Damn Few, 2014,861,Rorke Denver,Education & History,Fiction,Audio CD
American Caesar: Douglas MacArthur 1880 - 1964, 2008,864,William Manchester,Education & History,Non Fiction,Hardcover
Last Chance to See, 1992,862,Douglas Adams,Education & History,Fiction,Paperback
Norman Hall's Firefighter Exam Preparation Book, 2003,856,Norman Hall,Education & History,Non Fiction,Audio CD
"Encyclopedia of Electronic Components Volume 1: Resistors, Capacitors, Inductors, Switches, Encoders, Relays, Transistors", 2012,860,Charles Platt,Education & History,Fiction,Hardcover
And On That Bombshell: Inside the Madness and Genius of TOP GEAR, 2016,892,Richard Porter,Education & History,Non Fiction,Paperback
Vulcan 607: The Epic Story of the Most Remarkable British Air Attack Since WWII, 2012,885,Rowland White,Education & History,Fiction,Audio CD
Civilian Warriors: The Inside Story of Blackwater and the Unsung Heroes of the War on Terror, 2014,882,Erik Prince,Education & History,Non Fiction,Hardcover
"Amazon Alexa: The Complete User Manual - Tips, Tricks & Skills for Every Amazon Alexa Device (Alexa Amazon Echo)", 2018,885,CJ Andersen,Education & History,Fiction,Paperback
The Industries of the Future, 2017,887,Alec Ross,Education & History,Non Fiction,Audio CD
Healing the Fragmented Selves of Trauma Survivors: Overcoming Internal Self-Alienation, 2017,881,Janina Fisher,Education & History,Fiction,Hardcover
Helgoland: The Sunday Times bestseller, 2021,879,Carlo Rovelli,Education & History,Non Fiction,Paperback
Animals Make Us Human: Creating the Best Life for Animals, 2010,873,Temple Grandin,Education & History,Fiction,Audio CD
Collins Nicholson Inland Waterways Map of Great Britain (Collins Nicholson Waterways Guides), 2020,878,Collins Maps,Education & History,Non Fiction,Hardcover
1950s American Cars Memory Lane: Large print picture book for dementia patients, 2019,872,Hugh Morrison,Education & History,Fiction,Paperback
The Long Haul: A Trucker's Tales of Life on the Road, 2018,874,Finn Murphy,Education & History,Non Fiction,Audio CD
War Beneath the Sea: Submarine Conflict During World War II, 1998,872,Peter Padfield,Education & History,Fiction,Hardcover
Blackwater: The Rise of the World's Most Powerful Mercenary Army [Revised and Updated], 2008,870,Jeremy Scahill,Education & History,Non Fiction,Paperback
Let It Rot!: The Gardener's Guide to Composting (Third Edition) (Storey's Down-To-Earth Guides), 1998,915,Stu Campbell,Education & History,Fiction,Audio CD
The Master Algorithm: How the Quest for the Ultimate Learning Machine Will Remake Our World, 2018,914,Pedro Domingos,Education & History,Non Fiction,Hardcover
NASA Saturn V 1967-1973 (Apollo 4 to Apollo 17 & Skylab) (Owners' Workshop Manual), 2016,911,David Woods,Education & History,Fiction,Paperback
The Age of AI: And Our Human Future, 2021,915,Eric Schmidt,Education & History,Non Fiction,Audio CD
2018 International Residential Code for One- and Two-Family Dwellings (International Code Council Series), 2017,910,International Code Council,Education & History,Fiction,Hardcover
The New Bandsaw Box Book: Techniques & Patterns for the Modern Woodworker, 2020,908,David Picciuto,Education & History,Non Fiction,Paperback
"Bob Lang's The Complete Kitchen Cabinetmaker, Revised Edition: Shop Drawings and Professional Methods for Designing and Constructing Every Kind of Kitchen and Built-In Cabinet (Fox Chapel Publishing)", 2014,910,Robert W. Lang,Education & History,Fiction,Audio CD
The Poop Diaries, 2020,902,Abby Ross,Education & History,Non Fiction,Hardcover
"PPI FE Review Manual: Rapid Preparation for the Fundamentals of Engineering Exam, 3rd Edition – A Comprehensive Preparation Guide for the FE Exam", 2010,907,Michael  R. Lindeburg,Education & History,Fiction,Paperback
The Common Rule: Habits of Purpose for an Age of Distraction, 2019,902,Justin Whitmel Earley,Education & History,Non Fiction,Audio CD
Dark Emu: Aboriginal Australia and the birth of agriculture, 2018,903,Bruce Pascoe,Education & History,Fiction,Hardcover
Eames, 2005,896,Gloria Koenig,Education & History,Non Fiction,Paperback
Great Maps: The World's Masterpieces Explored and Explained (DK Great), 2014,899,Jerry Brotton,Education & History,Fiction,Audio CD
The Machine That Changed the World: The Story of Lean Production-- Toyota's Secret Weapon in the Global Car Wars That Is Now Revolutionizing World ... Wars That Is Revolutionizing World Industry), 2007,895,James P. Womack,Education & History,Non Fiction,Hardcover
"U.S. Armed Forces Nuclear, Biological And Chemical Survival Manual", 2003,939,Dick Couch,Education & History,Fiction,Paperback
"Into the Raging Sea: Thirty-Three Mariners, One Megastorm, and the Sinking of El Faro", 2019,941,Rachel Slade,Education & History,Non Fiction,Audio CD
Goodnight Brew: A Parody for Beer People, 2014,932,Karla Oceanak,Education & History,Fiction,Hardcover
The Beekeeper's Handbook, 2011,934,Diana Sammataro,Education & History,Non Fiction,Paperback
Raising Goats Fd., 2010,938,Cheryl K. Smith,Education & History,Fiction,Audio CD
Formula One 2022: The World's Bestselling Grand Prix Handbook, 2022,929,Bruce Jones,Education & History,Non Fiction,Hardcover
Where Good Ideas Come From: The Natural History of Innovation, 2011,935,Steven Johnson,Education & History,Fiction,Paperback
The Longest Day, 1994,930,Cornelius Ryan,Education & History,Non Fiction,Audio CD
First Man: The Life of Neil A. Armstrong, 2018,926,James R. Hansen,Education & History,Fiction,Hardcover
Bringing Columbia Home: The Untold Story of a Lost Space Shuttle and Her Crew, 2020,916,Jonathan H. Ward,Education & History,Non Fiction,Paperback
"The Pentagon's Brain: An Uncensored History of DARPA, America's Top-Secret Military Research Agency", 2015,920,Annie Jacobsen,Education & History,Fiction,Audio CD
Ask an Astronaut: My Guide to Life in Space, 2017,923,Tim Peake,Education & History,Non Fiction,Hardcover
"Backyard Ballistics: Build Potato Cannons, Paper Match Rockets, Cincinnati Fire Kites, Tennis Ball Mortars, and More Dynamite Devices", 2012,921,William Gurstelle,Education & History,Fiction,Paperback
"The Moth and the Mountain: A True Story of Love, War, and Everest", 2021,960,Ed Caesar,Education & History,Non Fiction,Audio CD
Fly Girls, 2019,953,Keith O'Brien,Education & History,Fiction,Hardcover
Heritage, 2014,949,Sean Brock,Education & History,Non Fiction,Paperback
The Way Home: Tales from a life without technology, 2021,950,Mark Boyle,Education & History,Fiction,Audio CD
The Finest Hours: The True Story of the U.S. Coast Guard's Most Daring Sea Rescue, 2010,949,Michael J. Tougias,Education & History,Non Fiction,Hardcover
You Can Farm: The Entrepreneur's Guide to Start & Succeed in a Farming Enterprise, 1998,946,Joel Salatin,Education & History,Fiction,Paperback
Understanding Human Communication, 2016,948,Ronald B. Adler,Education & History,Non Fiction,Audio CD
The Art of War: A Graphic Novel (Graphic Classics), 2018,948,Sun Tzu,Education & History,Fiction,Hardcover
Doctors from Hell: The Horrific Account of Nazi Experiments on Humans, 2005,943,Vivien Spitz,Education & History,Non Fiction,Paperback
Cozy White Cottage Seasons: 100 Ways to Be Cozy All Year Long, 2021,938,Liz Marie Galvan,Education & History,Fiction,Audio CD
Gino's Italian Coastal Escape: A Taste of Italy from the Aeolian Islands to Elba, 2018,935,Gino D'Acampo,Education & History,Non Fiction,Hardcover
"Epigenetics Revolution: How Modern Biology Is Rewriting Our Understanding of Genetics, Disease and Inheritance", 2012,977,Nessa Carey,Education & History,Fiction,Paperback
Feeding You Lies: How to Unravel the Food Industry's Playbook and Reclaim Your Health, 2020,971,Vani Hari,Education & History,Non Fiction,Audio CD
Total Competition: Lessons in Strategy from Formula One, 2017,974,Ross Brawn,Education & History,Fiction,Hardcover
"Farm and Workshop Welding: Everything You Need to Know to Weld, Cut, and Shape Metal (Fox Chapel Publishing) Over 400 Step-by-Step Photos to Help You Learn Hands-On Welding and Avoid Common Mistakes", 2012,974,Andrew Pearce,Education & History,Non Fiction,Paperback
Ship of Gold in the Deep Blue Sea, 1998,964,Gary Kinder,Education & History,Fiction,Audio CD
"Brain Wash: Detox Your Mind for Clearer Thinking, Deeper Relationships and Lasting Happiness", 2021,964,David Perlmutter,Education & History,Non Fiction,Hardcover
How Technology Works: The Facts Visually Explained (How Things Work), 2019,963,DK,Education & History,Fiction,Paperback
Countdown to Zero Day: Stuxnet and the Launch of the World's First Digital Weapon, 2015,968,Kim Zetter,Education & History,Non Fiction,Audio CD
"Nerves of Steel: How I Followed My Dreams, Earned My Wings, and Faced My Greatest Challenge", 2019,968,Captain Tammie Jo Shults,Education & History,Fiction,Hardcover
Sea People: In Search of the Ancient Navigators of the Pacific, 2020,961,Christina Thompson,Education & History,Non Fiction,Paperback
The Farmhouse Culture Guide to Fermenting: Crafting Live-Cultured Foods and Drinks with 100 Recipes from Kimchi to Kombucha [A Cookbook], 2019,965,Kathryn Lukas,Education & History,Fiction,Audio CD
Rise of the Robots: Technology and the Threat of a Jobless Future, 2016,958,Martin Ford,Education & History,Non Fiction,Hardcover
The Men Who Stare at Goats, 2006,994,Jon Ronson,Education & History,Fiction,Paperback
"Fossil Future: Why Global Human Flourishing Requires More Oil, Coal, and Natural Gas--Not Less", 2022,987,Alex Epstein,Education & History,Non Fiction,Audio CD
Crossroads: My Story of Tragedy and Resilience as a Humboldt Bronco, 2021,991,Kaleb Dahlgren,Education & History,Fiction,Hardcover
"The Everything Soapmaking Book: Learn How to Make Soap at Home with Recipes, Techniques, and Step-by-Step Instructions - Purchase the right equipment ... soaps, and Package and sell your creations", 2012,987,Alicia Grosso,Education & History,Non Fiction,Paperback
The LEGO Architect, 2015,986,Tom Alphin,Education & History,Fiction,Audio CD
"Cockpit Confidential: Everything You Need to Know About Air Travel: Questions, Answers, and Reflections", 2018,986,Patrick Smith,Education & History,Non Fiction,Hardcover
How to Invent Everything: A Survival Guide for the Stranded Time Traveler, 2019,981,Ryan North,Education & History,Fiction,Paperback
"The Backyard Homestead Guide to Raising Farm Animals: Choose the Best Breeds for Small-Space Farming, Produce Your Own Grass-Fed Meat, Gather Fresh ... Rabbits, Goats, Sheep, Pigs, Cattle, & Bees", 2011,982,Gail Damerow,Education & History,Non Fiction,Audio CD
Shadow of the Titanic: The Extraordinary Stories of Those Who Survived, 2013,985,Andrew Wilson,Education & History,Fiction,Hardcover
Tornado: In the Eye of the Storm, 2021,984,John Nichol,Education & History,Non Fiction,Paperback
My Life and Work, 2006,981,Henry Ford,Education & History,Fiction,Audio CD
"Cadillac Desert: The American West and Its Disappearing Water, Revised Edition", 1993,979,Marc Reisner,Education & History,Non Fiction,Hardcover
101 Ground Training Exercises for Every Horse & Handler (Read & Ride), 2012,974,Cherry Hill,Education & History,Fiction,Paperback
"A Captain's Duty: Somali Pirates, Navy SEALS, and Dangerous Days at Sea", 2010,1020,Richard Phillips,Education & History,Non Fiction,Audio CD
Highest Duty: My Search for What Really Matters, 2009,1012,Jeffrey Zaslow,Education & History,Fiction,Hardcover
El Arte de la Guerra (Spanish Edition), 2016,1015,Sun Tzu,Education & History,Non Fiction,Paperback
A Bright Shining Lie: John Paul Vann and America in Vietnam, 1989,1007,Neil Sheehan,Education & History,Fiction,Audio CD
"The Illustrated Art of War (Dover Military History, Weapons, Armor)", 2012,1014,Sun Tzu,Education & History,Non Fiction,Hardcover
Against the Web: A Cosmopolitan Answer to the New Right, 2020,1009,Michael Brooks,Education & History,Fiction,Paperback
"Fiery Ferments: 70 Stimulating Recipes for Hot Sauces, Spicy Chutneys, Kimchis with Kick, and Other Blazing Fermented Condiments", 2017,1005,Kirsten K. Shockey,Education & History,Non Fiction,Audio CD
Raven Rock: The Story of the U.S. Government's Secret Plan to Save Itself--While the Rest of Us Die, 2018,1009,Garrett M. Graff,Education & History,Fiction,Hardcover
Everything Electrical How To Use All The Functions On Your Multimeter, 2018,999,Vincent Keler,Education & History,Non Fiction,Paperback
The Golden Thread: How Fabric Changed History, 2021,1000,Kassia St. Clair,Education & History,Fiction,Audio CD
Alexa For Dummies (For Dummies (Computer/Tech)), 2021,996,Paul McFedries,Education & History,Non Fiction,Hardcover
Essential Oils (Quick Study Health), 2015,996,Inc. BarCharts,Education & History,Fiction,Paperback
How To Be An F1 Driver: My Guide To Life In The Fast Lane, 2019,1001,Jenson Button,Education & History,Non Fiction,Audio CD
"Around the World in 80 Trains: A 45,000-Mile Adventure", 2020,1057,Monisha Rajesh,Education & History,Fiction,Hardcover
This Kind of War: The Classic Korean War History - Fiftieth Anniversary Edition, 2000,1055,T.R. Fehrenbach,Education & History,Non Fiction,Paperback
Private Pilot Oral Exam Guide: The comprehensive guide to prepare you for the FAA checkride (Oral Exam Guide Series), 2017,1055,Michael D. Hayes,Education & History,Fiction,Audio CD
Ham Radio For Dummies, 2018,1045,H. Ward Silver,Education & History,Non Fiction,Hardcover
Skeletons on the Zahara: A True Story of Survival, 2005,1036,Dean King,Education & History,Fiction,Paperback
Universe: The Definitive Visual Guide, 2020,1039,DK,Education & History,Non Fiction,Audio CD
507 Mechanical Movements, 2013,1038,Henry T. Brown,Education & History,Fiction,Hardcover
What Your Doctor May Not Tell You About Menopause (TM): The Breakthrough Book on Natural Hormone Balance (What Your Doctor May Not Tell You About...(Paperback)), 2004,1029,John R. Lee MD,Education & History,Non Fiction,Paperback
507 Mechanical Movements: Mechanisms and Devices, 2010,1029,Henry T Brown,Education & History,Fiction,Audio CD
"How to Rebuild Your Volkswagen air-Cooled Engine (All models, 1961 and up)", 1987,1025,Tom Wilson,Education & History,Non Fiction,Hardcover
"The Aviators: Eddie Rickenbacker, Jimmy Doolittle, Charles Lindbergh, and the Epic Age of Flight", 2015,1021,Winston Groom,Education & History,Fiction,Paperback
"The New World Champion Paper Airplane Book: Featuring the World Record-Breaking Design, with Tear-Out Planes to Fold and Fly", 2013,1069,John M. Collins,Education & History,Non Fiction,Audio CD
"Knife Engineering: Steel, Heat Treating, and Geometry", 2020,1065,Dr. Larrin Thomas,Education & History,Fiction,Hardcover
Twenty Million Tons Under the Sea: The Daring Capture of the U-505, 2018,1063,Daniel V. Gallery,Education & History,Non Fiction,Paperback
Sodium Bicarbonate: Nature's Unique First Aid Remedy, 2014,1069,Mark Sircus,Education & History,Fiction,Audio CD
My Inventions: The Autobiography of Nikola Tesla, 2013,1070,Nikola Tesla,Education & History,Non Fiction,Hardcover
The Disappearing Act: The Impossible Case of MH370, 2022,1061,Florence de Changy,Education & History,Fiction,Paperback
Cod: A Biography of the Fish That Changed the World, 1997,1061,Mark Kurlansky,Education & History,Non Fiction,Audio CD
If Only They Could Talk, 2010,1060,James Herriot,Education & History,Fiction,Hardcover
When I Fell From the Sky, 2011,1060,Juliane Koepcke,Education & History,Non Fiction,Paperback
The Civil War: A Narrative: Volume 1: Fort Sumter to Perryville (Vintage Civil War Library), 1986,1053,Shelby Foote,Education & History,Fiction,Audio CD
"Deep Down Dark: The Untold Stories of 33 Men Buried in a Chilean Mine, and the Miracle That Set Them Free", 2015,1054,Héctor Tobar,Education & History,Non Fiction,Hardcover
The Disney Book: A Celebration of the World of Disney, 2015,1058,Jim Fanning,Education & History,Fiction,Paperback
"Total Control: High Performance Street Riding Techniques, 2nd Edition", 2015,1108,Lee Parks,Education & History,Non Fiction,Audio CD
How We Got to Now: Six Innovations That Made the Modern World, 2015,1103,Steven Johnson,Education & History,Fiction,Hardcover
Jupiters Travels: Four Years Around the World on a Triumph, 2005,1095,Ted Simon,Education & History,Non Fiction,Paperback
"Empowered: Ordinary People, Extraordinary Products (Silicon Valley Product Group)", 2020,1097,Marty Cagan,Education & History,Fiction,Audio CD
Iacocca: An Autobiography, 1985,1094,Lee Iacocca,Education & History,Non Fiction,Hardcover
"Woodworking: The Complete Step-by-Step Guide to Skills, Techniques, and Projects (Fox Chapel Publishing) Over 1,200 Photos & Illustrations, 41 Complete Plans, Easy-to-Follow Diagrams & Expert Guidance", 2019,1095,Tom Carpenter,Education & History,Fiction,Paperback
A Raid Over Berlin, 2019,1086,John Martin,Education & History,Non Fiction,Audio CD
The Toys of He-Man and the Masters of the Universe, 2021,1086,Val Staples,Education & History,Fiction,Hardcover
"The Chicken Health Handbook, 2nd Edition: A Complete Guide to Maximizing Flock Health and Dealing with Disease", 2015,1085,Gail Damerow,Education & History,Non Fiction,Paperback
The Official Overstreet Indian Arrowheads Identification and Price Guide (Official Overstreet Indian Arrowhead Identification and Price Guide), 2018,1084,Robert M Overstreet,Education & History,Fiction,Audio CD
Bomb: The Race to Build--and Steal--the World's Most Dangerous Weapon, 2012,1082,Steve Sheinkin,Education & History,Non Fiction,Hardcover
"Ugly’s Residential Wiring, 2020 Edition", 2020,1076,Charles R. Miller,Education & History,Fiction,Paperback
"1,001 ASVAB Practice Questions For Dummies (+ Free Online Practice)", 2013,1071,Rod Powers,Education & History,Non Fiction,Audio CD
Accessory to War: The Unspoken Alliance Between Astrophysics and the Military, 2019,1140,Neil deGrasse Tyson,Education & History,Fiction,Hardcover
"The Nasty Bits: Collected Cuts, Useable Trim, Scraps and Bones by Bourdain, Anthony (2006) Paperback", 2006,1143,Anthony Bourdain,Education & History,Non Fiction,Paperback
"Beeswax Alchemy: How to Make Your Own Soap, Candles, Balms, Creams, and Salves from the Hive", 2015,1143,Petra Ahnert,Education & History,Fiction,Audio CD
The Knowledge: How to Rebuild Civilization in the Aftermath of a Cataclysm, 2015,1137,Lewis Dartnell,Education & History,Non Fiction,Hardcover
Eating on the Wild Side: The Missing Link to Optimum Health, 2014,1134,Jo Robinson,Education & History,Fiction,Paperback
Flying Blind: The 737 MAX Tragedy and the Fall of Boeing, 2021,1140,Peter Robison,Education & History,Non Fiction,Audio CD
The Unabomber Manifesto: Industrial Society and Its Future, 2008,1140,The Unabomber,Education & History,Fiction,Hardcover
The Moral Case for Fossil Fuels, 2014,1121,Alex Epstein,Education & History,Non Fiction,Paperback
The Journey Home: Autobiography of an American Swami, 2010,1112,Radhanath Swami,Education & History,Fiction,Audio CD
A Man & His Car: Iconic Cars and Stories from the Men Who Love Them, 2020,1118,Matt Hranek,Education & History,Non Fiction,Hardcover
